segmentnrs	original	stemmed
T06D4064:157A-30	bsod nyams sel bas snying rje ba'o //	bsod nyams sel ba snying rje ba 
T06D4064:157A-31	bsod nyams zhes bya ba ni bde ba ste /	bsod nyams zhes byed ba ni bde ba ste 
T06D4064:157A-32	bde ba sel zhes bya ba'i tha tshig go //	bde ba sel zhes byed ba tha tshig go 
T06D4064:157B-0	snying rje can ni pha rol sdug @157b bsngal na sdug bsngal bar 'gyur ba'i phyir ro //	snying rje can ni pha rol sdug sngal na sdug sngal ba mang ba phyir ro 
T06D4064:157B-1	'di ni rnam par tho mi 'tshams pa'i las can no //	mang ni rnam ba tho mi mang ba las can no 
T06D4064:157B-2	dge ba bcu gcig bshad zin to /	dge ba 'chu gcig 'chad zin to 
T06D4064:157B-3	"//
 / de'i 'og tu nyon mongs pa rnams bstan pas de'i phyir de dag gi dbang du byas te /"	de mang tu nyon mongs ba rnams ston ba de phyir de 'dag gi dbang du byed te 
T06D4064:157B-4	nyon mongs ni /	nyon mongs ni 
T06D4064:157B-5	'dod chags khong khro gti mug dang //	mang chags khong khro gti mug dang 
T06D4064:157B-6	nga rgyal lta ba the tshom mo //	nga rgyal lta ba the tshom mo 
T06D4064:157B-7	zhes bya ba smos so //	zhes byed ba smos so 
T06D4064:157B-8	'dod chags dang khong khro ba dang gti mug ni 'dod chags khong khro gti mug go //	mang chags dang khong khro ba dang gti mug ni mang chags khong khro gti mug go 
T06D4064:157B-9	de la 'dod chags ni srid pa dang longs spyod la lhag par chags pa dang smon pa ste /	de la mang chags ni srid ba dang longs spyod la lhag ba chags ba dang smon ba ste 
T06D4064:157B-10	de ni sdug bsngal kun bskyed pa'i las can no //	de ni sdug sngal kun skyed ba las can no 
T06D4064:157B-11	sdug bsngal ni 'dir nye bar len pa'i phung po rnams te /	sdug sngal ni mang nye ba len ba 'phung po rnams te 
T06D4064:157B-12	de dag ni 'dod pa dang /	de 'dag ni mang ba dang 
T06D4064:157B-13	gzugs dang /	gzugs dang 
T06D4064:157B-14	gzugs med pa'i srid pa'i dbang gis mngon par 'grub pas de'i phyir 'dod chags kyi las ni sdug bsngal kun skyed par bshad do //	gzugs med ba srid ba dbang gis mngon ba mang ba de phyir mang chags kyi las ni sdug sngal kun skyed ba 'chad do 
T06D4064:157B-15	khong khro ba ni sems can rnams la kun nas mnar sems pa ste /	khong khro ba ni sems can rnams la kun nas mnar sems ba ste 
T06D4064:157B-16	sems can rnams la sems rtsub pa'o //	sems can rnams la sems rtsub ba 
T06D4064:157B-17	des non na sems can rnams la gsod pa dang 'ching ba la sogs pa'i gnod pa bya bar sems so //	des non na sems can rnams la gsod ba dang mang ba la sogs ba gnod ba byed ba sems so 
T06D4064:157B-18	de ni reg par mi gnas pa dang nyes par spyod pa'i rten byed pa'i las can no //	de ni reg ba mi gnas ba dang nyes ba spyod ba rten byed ba las can no 
T06D4064:157B-19	reg pa ni bde ba ste /	reg ba ni bde ba ste 
T06D4064:157B-20	de dang lhan cig gnas pa ni reg par gnas pa'o //	de dang lhan cig gnas ba ni reg ba gnas ba 
T06D4064:157B-21	reg pa dang gnas ma yin pa ni reg par mi gnas pa ste /	reg ba dang gnas ma yin ba ni reg ba mi gnas ba ste 
T06D4064:157B-22	sdug bsngal lhan cig ces bya ba'i tha tshig go //	sdug sngal lhan cig ces byed ba tha tshig go 
T06D4064:157B-23	kun nas mnar sems kyi sems yod na gdon mi za bar yid mi bde ba kun du 'byung ba'i phyir sems la gdung bar 'gyur ro //	kun nas mnar sems kyi sems yod na 'don mi za ba yid mi bde ba kun du mang ba phyir sems la gdung ba mang ro 
T06D4064:157B-24	sems kyi rjes su 'gyur bas lus la yang gdung bar yang 'gyur ba nyid de'i spyod lam thams cad du sdug bsngal dang bcas shing phongs ba dang bcas par gnas par 'gyur ro //	sems kyi rjes su mang ba lus la yang gdung ba yang mang ba nyid de spyod lam thams cad du sdug sngal dang 'cha' shing 'phong ba dang 'cha' ba gnas ba mang ro 
T06D4064:157B-25	zhe 'gras pa'i sems dang ldan pa ni nyes bar spyod pa gang dang yang rigs pa ma yin pas khong khro ba ni reg par mi gnas pa dang /	zhe mang ba sems dang ldan ba ni nyes ba spyod ba gang dang yang rigs ba ma yin ba khong khro ba ni reg ba mi gnas ba dang 
T06D4064:157B-26	nyes par spyod pa'i rten byed pa'i las can du bshad do //	nyes ba spyod ba rten byed ba las can du 'chad do 
T06D4064:157B-27	gti mug ni ngan song rnams dang bde 'gro dang mya ngan las 'das pa dang de thob par byed pa'i rgyu dang de dag gi rgyu dang 'bras bur 'brel pa phyin ci ma log pa la gang mi shes pa'o //	gti mug ni ngan 'gro rnams dang bde mang dang mya ngan las mang ba dang de 'thob ba byed ba rgyu dang de 'dag gi rgyu dang mang bur mang ba phyin ci ma log ba la gang mi shes ba 
T06D4064:158A-0	'di ni kun nas nyon mongs pa 'byung @158a * //	mang ni kun nas nyon mongs ba mang 
T06D4064:158A-1	ba'i rten byed pa'i las can no //	ba rten byed ba las can no 
T06D4064:158A-2	de la nyon mongs pa ste las dang /	de la nyon mongs ba ste las dang 
T06D4064:158A-3	skye ba'i bdag nyid ni kun nas nyon mongs pa rnam pa gsum mo //	skye ba bdag nyid ni kun nas nyon mongs ba rnam ba gsum mo 
T06D4064:158A-4	de 'byung ba ni kun nas nyon mongs pa'i snga ma snga ma rgyur gyur pa las kun nas nyon mongs pa phyi ma phyi ma'i bdag nyid rnyed pa'o //	de mang ba ni kun nas nyon mongs ba snga ma snga ma rgyur gyur ba las kun nas nyon mongs ba phyi ma phyi ma bdag nyid rnyed ba 
T06D4064:158A-5	'byung ba'i rten byed pa ni rmongs par gyur la log par shes pa dang the tshom dang 'dod chags la sogs pa nyon mongs pa las yang srid pa'i las dang skye ba rnams 'byung gi rmongs par ma gyur na ni ma yin no //	mang ba rten byed ba ni rmongs ba gyur la log ba shes ba dang the tshom dang mang chags la sogs ba nyon mongs ba las yang srid ba las dang skye ba rnams mang gi rmongs ba ma gyur na ni ma yin no 
T06D4064:158A-6	nga rgyal ni nga rgyal zhes bya ba thams cad kyang 'jig tshogs la lta ba la brten nas 'byung ba'o //	nga rgyal ni nga rgyal zhes byed ba thams cad kyang mang tshogs la lta ba la rten nas mang ba 
T06D4064:158A-7	de ni sems khengs pa'i mtshan nyid de /	de ni sems kheng ba mtshan nyid de 
T06D4064:158A-8	'di ltar phung po rnams la bdag gam bdag gi dngos por sgro btags nas /	mang ltar 'phung po rnams la bdag gam bdag gi dngos por sgro 'dogs nas 
T06D4064:158A-9	'di ni bdag go //	mang ni bdag go 
T06D4064:158A-10	'di ni bdag gi'o zhes de dang de'i khyad par gyis bdag khengs shing gzhan dag las lhag par rlom sems pa'o //	mang ni bdag gi zhes de dang de khyad ba gyis bdag kheng shing gzhan 'dag las lhag ba rlom sems ba 
T06D4064:158A-11	de ni mi gus pa dang sdug bsngal 'byung ba'i rten byed pa'i las can no //	de ni mi gus ba dang sdug sngal mang ba rten byed ba las can no 
T06D4064:158A-12	mi gus pa ni bla ma rnams dang /	mi gus ba ni bla ma rnams dang 
T06D4064:158A-13	gang zag yon tan can rnams la 'gying zhing lus dang ngag gi sri zhu med pa'o //	gang zag yon tan can rnams la mang zhing lus dang ngag gi sri 'ju med ba 
T06D4064:158A-14	sdug bsngal 'byung ba ni 'dir yang srid pa 'byung ba'o //	sdug sngal mang ba ni mang yang srid ba mang ba 
T06D4064:158A-15	de ni sems nges pa'i rang gi ngo bor bye brag med kyang sems khengs pa'i rgyu'i bye brag gis rnam pa bdun du tha dad de /	de ni sems nges ba rang gi ngo 'bor 'bye brag med kyang sems kheng ba rgyu 'bye brag gis rnam ba bdun du tha dad de 
T06D4064:158A-16	nga rgyal dang che ba'i nga rgyal zhes bya ba la sogs pa'o //	nga rgyal dang che ba nga rgyal zhes byed ba la sogs ba 
T06D4064:158A-17	rigs dang shes rgya dang nor la sogs pas dma' babs kyang rigs dang shes rgya dang nor rnams kyis bdag che'o snyam du sems khengs pa gang yin pa'am /	rigs dang shes rgya dang nor la sogs ba dma 'bab kyang rigs dang shes rgya dang nor rnams kyis bdag che snyam du sems kheng ba gang yin ba 
T06D4064:158A-18	rigs la sogs pas mtshungs pa nyid la bdag dang mtshungs so snyam du sems khengs ba gang yin pa de ni nga rgyal lo //	rigs la sogs ba mtshungs ba nyid la bdag dang mtshungs so snyam du sems kheng ba gang yin ba de ni nga rgyal lo 
T06D4064:158A-19	che ba'i nga rgyal ni rigs dang shes rgya dang nor la sogs pa mtshungs ba bas gtong ba dang tshul khrims dang nyams rtsal la sogs pas bdag che'o snyam pa'am /	che ba nga rgyal ni rigs dang shes rgya dang nor la sogs ba mtshungs ba ba gtong ba dang tshul khrims dang nyams rtsal la sogs ba bdag che snyam ba 
T06D4064:158A-20	rigs dang nor dang rigs pa la sogs pas che ba la shes rgya dang nor la sogs pas bdag mtshungs so snyam pa ste /	rigs dang nor dang rigs ba la sogs ba che ba la shes rgya dang nor la sogs ba bdag mtshungs so snyam ba ste 
T06D4064:158A-21	'di ni che ba'i nga rgyal lo //	mang ni che ba nga rgyal lo 
T06D4064:158A-22	rigs dang shes rgya dang nor rnams kyi che ba bas kyang rigs dang shes rgya dang nor la sogs pas bdag che'o snyam du sems khengs pa gang yin pa 'di ni nga rgyal las kyang nga rgyal lo //	rigs dang shes rgya dang nor rnams kyi che ba ba kyang rigs dang shes rgya dang nor la sogs ba bdag che snyam du sems kheng ba gang yin ba mang ni nga rgyal las kyang nga rgyal lo 
T06D4064:158B-0	nga'o @158b snyam pa'i nga rgyal ni nye bar len pa'i phung po lnga po bdag dang bdag gi med pa rnams la bdag dang bdag gir mngon par zhen nas sems khengs pa gang yin pa ste /	nga snyam ba nga rgyal ni nye ba len ba 'phung po lnga po bdag dang bdag gi med ba rnams la bdag dang bdag gir mngon ba zhen nas sems kheng ba gang yin ba ste 
T06D4064:158B-1	'di ni nga'o snyam pa'i nga rgyal lo //	mang ni nga snyam ba nga rgyal lo 
T06D4064:158B-2	mngon pa'i nga rgyal ni gong ma'i khyad par thob par bya bar thob par bdag gis thob po snyam du sems khengs pa gang yin pa ste /	mngon ba nga rgyal ni gong ma khyad ba 'thob ba byed ba 'thob ba bdag gis 'thob po snyam du sems kheng ba gang yin ba ste 
T06D4064:158B-3	'di ni mngon pa'i nga rgyal lo //	mang ni mngon ba nga rgyal lo 
T06D4064:158B-4	cung zad snyam pa'i nga rgyal ni rigs dang rigs pa la sogs pas khyed che bar 'phags pa bas rigs dang rigs pa la sogs pas cung zad cig gis bdag chung ngo snyam du sems khengs pa gang yin pa ste /	cung zad snyam ba nga rgyal ni rigs dang rigs ba la sogs ba 'khyed che ba mang ba ba rigs dang rigs ba la sogs ba cung zad cig gis bdag chung ngo snyam du sems kheng ba gang yin ba ste 
T06D4064:158B-5	'di ni cung zad snyam pa'i nga rgyal lo //	mang ni cung zad snyam ba nga rgyal lo 
T06D4064:158B-6	log pa'i nga rgyal ni yon tan ma yin pa dang ldan la bdag yon tan dang ldan no snyam du sems khengs pa gang yin pa ste /	log ba nga rgyal ni yon tan ma yin ba dang ldan la bdag yon tan dang ldan no snyam du sems kheng ba gang yin ba ste 
T06D4064:158B-7	'di ni log pa'i nga rgyal lo //	mang ni log ba nga rgyal lo 
T06D4064:158B-8	yon tan ma yin pa ni 'chal ba'i tshul khrims la sogs pa ste /	yon tan ma yin ba ni mang ba tshul khrims la sogs ba ste 
T06D4064:158B-9	de dag su la yod pa de yon tan ma yin pa dang ldan pa'o //	de 'dag su la yod ba de yon tan ma yin ba dang ldan ba 
T06D4064:158B-10	de bas na bdag yon tan dang ldan no snyam pa des sbyin ba dang tshul khrims la sogs pa med bar yon tan de dang ldan pa nyid du khas blangs pa yin no //	de ba na bdag yon tan dang ldan no snyam ba des sbyin ba dang tshul khrims la sogs ba med ba yon tan de dang ldan ba nyid du khas blangs ba yin no 
T06D4064:158B-11	de'i phyir dngos po med bas na log pa'i nga rgyal zhes bya'o //	de phyir dngos po med ba na log ba nga rgyal zhes byed 
T06D4064:158B-12	lta ba zhes bya ba ni spyir bshad du zin kyang nyon mongs par gtogs pas nyon mongs pa'i bdag nyid lnga kho na ste /	lta ba zhes byed ba ni spyir 'chad du zin kyang nyon mongs ba gtogs ba nyon mongs ba bdag nyid lnga kho na ste 
T06D4064:158B-13	'jig tshogs la lta ba la sogs pa'i lta ba dang sbyar gyi 'jig rten gyi yang dag par lta ba dang /	mang tshogs la lta ba la sogs ba lta ba dang sbyor gyi mang rten gyi yang 'dag ba lta ba dang 
T06D4064:158B-14	zag pa med ba'i lta ba ni ma yin no //	zag ba med ba lta ba ni ma yin no 
T06D4064:158B-15	de dag ni nyon mongs pa can dang /	de 'dag ni nyon mongs ba can dang 
T06D4064:158B-16	rtog pa'i tshul du bye brag med kyang dmigs pa dang rnam pa'i bye brag gis phan tshun tha dad do //	rtogs ba tshul du 'bye brag med kyang dmigs ba dang rnam ba 'bye brag gis phan tshun tha dad do 
T06D4064:158B-17	de la 'jig tshogs la lta ba ni nye bar len pa'i phung po lnga po rnams la gang bdag dang bdag gir lta ba'o //	de la mang tshogs la lta ba ni nye ba len ba 'phung po lnga po rnams la gang bdag dang bdag gir lta ba 
T06D4064:158B-18	mthar 'dzin par lta ba ni nye bar len pa'i phung po lnga po la bdag tu bzung ba de dag nyid la gang chad pa'am /	mthar mang ba lta ba ni nye ba len ba 'phung po lnga po la bdag tu bzung ba de 'dag nyid la gang 'chad ba 
T06D4064:158B-19	rtag par lta ba'o //	rtag ba lta ba 
T06D4064:158B-20	log par lta ba ni lta ba gang gi rgyu'am 'bras bu'am /	log ba lta ba ni lta ba gang gi rgyu mang bu 
T06D4064:158B-21	byed pa la skur pa 'debs pa'am /	byed ba la skur ba mang ba 
T06D4064:158B-22	dngos po yod pa 'jig par byed pa ste /	dngos po yod ba mang ba byed ba ste 
T06D4064:158B-23	'di ni lta ba thams cad kyi nang na sdig pa yin pas log par lta ba zhes bya'o //	mang ni lta ba thams cad kyi nang na sdig ba yin ba log ba lta ba zhes byed 
T06D4064:159A-0	lta ba mchog tu 'dzin pa ni nye bar len pa'i phung po lnga po @159a * //	lta ba mchog tu mang ba ni nye ba len ba 'phung po lnga po 
T06D4064:159A-1	rnams la mchog dang khyad par du 'phags pa dang gtso bo dang dam par lta ba gang yin pa'o //	rnams la mchog dang khyad ba du mang ba dang gtso 'bo dang dam ba lta ba gang yin ba 
T06D4064:159A-2	tshul khrims dang brtul zhugs mchog tu 'dzin pa ni nye bar len pa'i phung po lnga rnams la dag pa dang grol ba dang nges par 'byin par lta ba'o //	tshul khrims dang brtul 'jug mchog tu mang ba ni nye ba len ba 'phung po lnga rnams la 'dag ba dang grol ba dang nges ba mang ba lta ba 
T06D4064:159A-3	the tshom ni las dang 'bras bu dang /	the tshom ni las dang mang bu dang 
T06D4064:159A-4	bden pa dang dkon mchog rnams la yid gnyis za ba ste /	bden ba dang dkon(d) mchog rnams la yid gnyis za ba ste 
T06D4064:159A-5	yod dam med snyam du blo sna tshogs byed pa ni yid gnyis so //	yod dam med snyam du blo sna tshogs byed ba ni yid gnyis so 
T06D4064:159A-6	'di ni shes rab las rang bzhin gzhan nyid do //	mang ni shes rab las rang bzhin gzhan nyid do 
T06D4064:159A-7	nyon mongs pa drug bshad zin to /	nyon mongs ba drug 'chad zin to 
T06D4064:159A-8	"//
 / kham po gnyis pa ste tha ma'o //"	kham po gnyis ba ste tha ma 
T06D4064:159A-9	de'i 'og tu bstan pa nye ba'i nyon mongs pa rnams bshad pa'i phyir /	de mang tu ston ba nye ba nyon mongs ba rnams 'chad ba phyir 
T06D4064:159A-10	khro dang khon du 'dzin pa dang //	khro dang khon du mang ba dang 
T06D4064:159A-11	'chab dang 'tshig dang phrag dog dang //	mang dang mang dang phrag dog dang 
T06D4064:159A-12	ser sna dang ni sgyur bcas dang //	ser sna dang ni sgyur 'cha' dang 
T06D4064:159A-13	g-yo rgyags rnam 'tshe ngo tsha med //	g-yo rgyags rnam mang ngo tsha med 
T06D4064:159A-14	khrel med rmugs dang rgod pa dang //	'khrel med rmugs dang rgod ba dang 
T06D4064:159A-15	ma dad pa dang le lo dang //	ma dad ba dang le lo dang 
T06D4064:159A-16	bag med pa dang brjed ngas dang //	bag med ba dang brjed ngas dang 
T06D4064:159A-17	rnam g-yengs shes bzhin ma yin dang //	rnam g-yengs shes bzhin ma yin dang 
T06D4064:159A-18	'gyod dang gnyid kyang de bzhin te //	mang dang rnyid kyang de bzhin te 
T06D4064:159A-19	rtog pa dang ni dpyod pa dang //	rtogs ba dang ni dpyod ba dang 
T06D4064:159A-20	nye ba'i nyon mongs gnyis rnam gnyis //	nye ba nyon mongs gnyis rnam gnyis 
T06D4064:159A-21	zhes bya ba smos so //	zhes byed ba smos so 
