segmentnrs	original	stemmed
T06D4064:162B-18	de la tshor ba btang snyoms nyid de /	de la tshor ba gtong snyom nyid de 
T06D4064:162B-19	ma bsgribs la lung du ma bstan pa'o //	ma sgrib la lung du ma ston ba 
T06D4064:162B-20	nyon mongs pa can gyi yid ni kun du 'gro ba lnga dang /	nyon mongs ba can gyi yid ni kun du mang ba lnga dang 
T06D4064:162B-21	bdag tu rmongs pa la sogs pa nyon mongs pa bzhi dang rtag tu mtshungs par ldan no //	bdag tu rmongs ba la sogs ba nyon mongs ba bzhi dang rtag tu mtshungs ba ldan no 
T06D4064:162B-22	de la yang tshor ba ni btang snyoms nyid de /	de la yang tshor ba ni gtong snyom nyid de 
T06D4064:162B-23	bsgribs la lung du ma bstan pa'o //	sgrib la lung du ma ston ba 
T06D4064:162B-24	de ni 'di bsam par bya ste ci mig gi rnam par shes pa la sogs pa lnga po dag cig car dmigs pa'i rkyen dang phrad kyang kun gzhi rnam par shes pa las gcig 'byung gi / gnyis dang mang po mi 'byung ste /	de ni mang bsam ba byed ste ci mig gi rnam ba shes ba la sogs ba lnga po 'dag cig car dmigs ba rkyen dang 'phrad kyang kun gzhi rnam ba shes ba las gcig mang gi gnyis dang mang po mi mang ste 
T06D4064:162B-25	ji ltar kha cig sems pa cig car gnyis dang mang po ma yin te /	ji ltar kha cig sems ba cig car gnyis dang mang po ma yin te 
T06D4064:162B-26	de ma thag pa'i rkyen med pas rnam par shes pa gcig kho na 'byung bar 'gyur te /	de ma thag ba rkyen med ba rnam ba shes ba gcig kho na mang ba mang te 
T06D4064:162B-27	rnam par shes pa gcig gis mang po'i de ma thag pa'i rkyen byed bar mi nus so snyam pa lta bu'am /	rnam ba shes ba gcig gis mang po de ma thag ba rkyen byed ba mi nus so snyam ba lta bu 
T06D4064:162B-28	'on te nges pa med de gal te gcig gi rkyen dang phrad na gcig 'byung bar 'gyur la /	mang te nges ba med de gal te gcig gi rkyen dang 'phrad na gcig mang ba mang la 
T06D4064:162B-29	de bzhin du gnyis dang mang po'i rkyen dang phrad na gnyis dang mang po yang 'byung bar 'gyur ram snyam pa la /	de bzhin du gnyis dang mang po rkyen dang 'phrad na gnyis dang mang po yang mang ba mang ram snyam ba la 
T06D4064:163A-0	de'i phyir @163a * //	de phyir 
T06D4064:163A-1	lnga rnams rtsa ba'i rnam shes las //	lnga rnams rtsa ba rnam shes las 
T06D4064:163A-2	ji lta'i rkyen las byung ba ni //	ji lta rkyen las 'byung ba ni 
T06D4064:163A-3	rnam shes lhan cig gam ma yin //	rnam shes lhan cig gam ma yin 
T06D4064:163A-4	chu las rlabs rnams ji bzhin no //	chu las rlabs rnams ji bzhin no 
T06D4064:163A-5	zhes bya ba smos so //	zhes byed ba smos so 
T06D4064:163A-6	lnga rnams zhes bya ba ni mig la sogs pa rnams par shes pa rnams te /	lnga rnams zhes byed ba ni mig la sogs ba rnams ba shes ba rnams te 
T06D4064:163A-7	de'i rjes su rgyu ba yid kyi rnam par shes pa dang bcas pa rnams so //	de rjes su rgyu ba yid kyi rnam ba shes ba dang 'cha' ba rnams so 
T06D4064:163A-8	lnga po rnams kyi sa bon gyi gnas yin pas de las byung ba dang /	lnga po rnams kyi sa bon gyi gnas yin ba de las 'byung ba dang 
T06D4064:163A-9	'gro ba rnams su skye ba nye bar len pa'i phyir kun gzhi rnam par shes pa ni rtsa ba'i rnam par shes pa zhes bya'o //	mang ba rnams su skye ba nye ba len ba phyir kun gzhi rnam ba shes ba ni rtsa ba rnam ba shes ba zhes byed 
T06D4064:163A-10	ji lta'i rkyen las zhes bya ba ni gang dang gang gi rkyen dang phrad pa de dang de nges par 'byung ste /	ji lta rkyen las zhes byed ba ni gang dang gang gi rkyen dang 'phrad ba de dang de nges ba mang ste 
T06D4064:163A-11	'byung ba ni bdag thob pa'o //	mang ba ni bdag 'thob ba 
T06D4064:163A-12	lhan cig gam ma yin zhes bya ba ni cig car ram rim gyis so //	lhan cig gam ma yin zhes byed ba ni cig car ram rim gyis so 
T06D4064:163A-13	chu la rlabs rnams ji bzhin zhes bya ba ni kun gzhi rnam par shes pa las 'jug pa'i rnam par shes pa cig car ram cig car ma yin par 'gyur ba'i dpe ste /	chu la rlabs rnams ji bzhin zhes byed ba ni kun gzhi rnam ba shes ba las mang ba rnam ba shes ba cig car ram cig car ma yin ba mang ba dpe ste 
T06D4064:163A-14	ji skad du blo gros yangs pa dper na chu bo'i chu rgyun du 'bab pa la gal te rlabs gcig 'byung ba'i rkyen nye bar gnas par gyur na rlabs gcig 'byung ngo //	ji skad du blo gros yangs ba dper na chu 'bo chu rgyun du mang ba la gal te rlabs gcig mang ba rkyen nye ba gnas ba gyur na rlabs gcig mang ngo 
T06D4064:163A-15	gal te gnyis sam gsum mam /	gal te gnyis sam gsum mam 
T06D4064:163A-16	rlabs mang po 'byung ba'i rkyen nye bar gnas par gyur na yang rlabs mang po 'byung ste /	rlabs mang po mang ba rkyen nye ba gnas ba gyur na yang rlabs mang po mang ste 
T06D4064:163A-17	chu bo'i chu rgyun yang chad par mi 'gyur la /	chu 'bo chu rgyun yang 'chad ba mi mang la 
T06D4064:163A-18	yongs su zad par yang mi mngon pa de bzhin du blo gros yangs pa chu bo de'i gnas lta bu'i kun gzhi rnam par shes pa la kun du brten cing rab tu gnas nas gal te mig gi rnam par shes pa la gcig pu 'byung ba'i rkyen nye bar gnas par gyur na mig gi rnam par shes pa gcig pu 'byung ngo //	yongs su zad ba yang mi mngon ba de bzhin du blo gros yangs ba chu 'bo de gnas lta bu kun gzhi rnam ba shes ba la kun du rten cing rab tu gnas nas gal te mig gi rnam ba shes ba la gcig pu mang ba rkyen nye ba gnas ba gyur na mig gi rnam ba shes ba gcig pu mang ngo 
T06D4064:163A-19	gal te rnam par shes pa gnyis sam gsum mam lnga 'byung ba'i rkyen nye bar gnas par gyur na yang gnyis sam gsum mam lnga'i bar du 'byung bar 'gyur ro zhes gsungs ba lta bu'o //	gal te rnam ba shes ba gnyis sam gsum mam lnga mang ba rkyen nye ba gnas ba gyur na yang gnyis sam gsum mam lnga ba du mang ba mang ro zhes gsungs ba lta bu 
T06D4064:163A-20	'di la tshigs su bcad pa /	mang la tshigs su gcod ba 
T06D4064:163A-21	len pa'i rnam par shes pa zab cing phra //	len ba rnam ba shes ba zab cing phra 
T06D4064:163A-22	sa bon thams cad chu bo bzhin du 'bab //	sa bon thams cad chu 'bo bzhin du mang 
T06D4064:163A-23	bdag tu rtog par gyur na mi rung zhes //	bdag tu rtogs ba gyur na mi rung zhes 
T06D4064:163A-24	'di ni byis pa rnams la ngas ma bstan //	mang ni byis ba rnams la ngas ma ston 
T06D4064:163A-25	zhe'o //	zhe 
T06D4064:163B-0	rnam par shes pa'i dmigs pa'i rkyen so sor nges pa bzhin du de ma thag pa'i rkyen ni mi @163b 'dod de /	rnam ba shes ba dmigs ba rkyen so sor nges ba bzhin du de ma thag ba rkyen ni mi mang de 
T06D4064:163B-1	rnam par shes pa thams cad 'byung ba de rnam par shes pa thams cad kyi de ma thag pa'i rkyen du khas len pas /	rnam ba shes ba thams cad mang ba de rnam ba shes ba thams cad kyi de ma thag ba rkyen du khas len ba 
T06D4064:163B-2	dmigs pa'i rkyen dang phrad na de ma thag pa'i rkyen gcig pu de las kyang rnam par shes pa gnyis sam mang po 'byung ste /	dmigs ba rkyen dang 'phrad na de ma thag ba rkyen gcig pu de las kyang rnam ba shes ba gnyis sam mang po mang ste 
T06D4064:163B-3	'gal bar mi 'gyur ro //	mang ba mi mang ro 
T06D4064:163B-4	gang de ma thag pa'i rkyen so sor nges pa med pa la lnga po rnams cig car dmigs pa'i rkyen dang phrad kyang gcig kho na la 'byung bar 'gyur gyi /	gang de ma thag ba rkyen so sor nges ba med ba la lnga po rnams cig car dmigs ba rkyen dang 'phrad kyang gcig kho na la mang ba mang gyi 
T06D4064:163B-5	lnga char ma yin no zhes bya ba 'di la gtan tshigs ci zhig yod /	lnga char ma yin no zhes byed ba mang la gtan tshigs ci 'jig yod 
T06D4064:163B-6	de lta bas na dmigs pa yod na lnga char 'byung ba'am /	de lta ba na dmigs ba yod na lnga char mang ba 
T06D4064:163B-7	yang na mi 'byung bar khas blangs dgos so //	yang na mi mang ba khas blangs dgos so 
T06D4064:163B-8	da ni 'di brjod par bya ste /	da ni mang rjod ba byed ste 
T06D4064:163B-9	ci yid kyi rnam par shes pa mig la sogs pa'i rnam par shes pa dag dang lhan cig 'byung ngam /	ci yid kyi rnam ba shes ba mig la sogs ba rnam ba shes ba 'dag dang lhan cig mang ngam 
T06D4064:163B-10	'on te de dag med kyang 'byung snyam pa la de'i phyir /	mang te de 'dag med kyang mang snyam ba la de phyir 
T06D4064:163B-11	yid kyi rnam shes 'byung ba ni //	yid kyi rnam shes mang ba ni 
T06D4064:163B-12	rtag tu'o 'du shes med pa dang //	rtag tu mang shes med ba dang 
T06D4064:163B-13	snyoms bar 'jug pa rnam gnyis dang //	snyom ba mang ba rnam gnyis dang 
T06D4064:163B-14	sems med gnyid dang brgyal ma gtogs //	sems med rnyid dang brgyal ma gtogs 
T06D4064:163B-15	zhes bya ba smos so //	zhes byed ba smos so 
T06D4064:163B-16	rtag tu zhes bya ba ni dus thams cad de /	rtag tu zhes byed ba ni dus thams cad de 
T06D4064:163B-17	mig la sogs pa'i rnam par shes pa dang lhan cig pa dang de ma yin pa zhes bya ba'i tha tshig go //	mig la sogs ba rnam ba shes ba dang lhan cig ba dang de ma yin ba zhes byed ba tha tshig go 
T06D4064:163B-18	phyir btang ba 'di'i dmigs kyis bsal ba rtsom ste /	phyir gtong ba mang dmigs kyis bsal ba rtsom ste 
T06D4064:163B-19	'du shes med pa dang /	mang shes med ba dang 
T06D4064:163B-20	snyoms par 'jug pa rnam pa gnyis dang /	snyom ba mang ba rnam ba gnyis dang 
T06D4064:163B-21	sems med gnyid dang brgyal ma gtogs //	sems med rnyid dang brgyal ma gtogs 
T06D4064:163B-22	de la 'du shes med pa pa ni 'du shes med pa'i sems can lha rnams kyi nang du skyes pa'i sems dang sems las byung ba'i chos rnams gang 'gog pa'o //	de la mang shes med ba ba ni mang shes med ba sems can lha rnams kyi nang du skye ba sems dang sems las 'byung ba chos rnams gang mang ba 
T06D4064:163B-23	snyoms par 'jug pa rnam pa gnyis ni /	snyom ba mang ba rnam ba gnyis ni 
T06D4064:163B-24	'du shes med pa'i snyoms par 'jug pa dang /	mang shes med ba snyom ba mang ba dang 
T06D4064:163B-25	'gog pa'i snyoms par 'jug pa'o //	mang ba snyom ba mang ba 
T06D4064:163B-26	de la 'du shes med pa'i snyoms par 'jug pa ni bsam gtan gsum pa'i 'dod chags dang bral la gong ma'i 'dod chags dang ma bral ba 'byung ba'i 'du shes sngon du btang ba'i yid la byed pas yid kyi rnam par shes pa dang de dang mtshungs par ldan pa'i sems las byung ba rnams gang 'gog pa ste /	de la mang shes med ba snyom ba mang ba ni bsam gtan gsum ba mang chags dang 'bral la gong ma mang chags dang ma 'bral ba mang ba mang shes sngon du gtong ba yid la byed ba yid kyi rnam ba shes ba dang de dang mtshungs ba ldan ba sems las 'byung ba rnams gang mang ba ste 
T06D4064:163B-27	de ni 'dir 'du shes med pa'i snyoms par 'jug pa zhes bya'o //	de ni mang mang shes med ba snyom ba mang ba zhes byed 
T06D4064:163B-28	'dis 'gog par 'gyur bas 'gog pa'o //	mang mang ba mang ba mang ba 
T06D4064:164A-0	de yang yid @164a * //	de yang yid 
T06D4064:164A-1	kyi rnam par shes pa mtshungs par ldan pa dang bcas pa'i mi 'byung bar 'gog pa ste /	kyi rnam ba shes ba mtshungs ba ldan ba dang 'cha' ba mi mang ba mang ba ste 
T06D4064:164A-2	gnas kyi gnas skabs kyi bye brag go //	gnas kyi gnas skabs kyi 'bye brag go 
T06D4064:164A-3	snyoms par 'jug pa de yang sems kyi 'og tu sems gzhan 'byung ba dang /	snyom ba mang ba de yang sems kyi mang tu sems gzhan mang ba dang 
T06D4064:164A-4	mi mthun pa'i gnas thob par byed pas snyoms par 'jug pa zhes bya'o //	mi mthun ba gnas 'thob ba byed ba snyom ba mang ba zhes byed 
T06D4064:164A-5	'gog pa'i snyoms par 'jug pa ni ci yang med pa'i skye mched kyi 'dod chags dang bral ba zhi bar gnas pa'i 'du shes sngon du btang ba'i yid la byed pas yid kyi rnam par shes pa dang /	mang ba snyom ba mang ba ni ci yang med ba skye mched kyi mang chags dang 'bral ba zhi ba gnas ba mang shes sngon du gtong ba yid la byed ba yid kyi rnam ba shes ba dang 
T06D4064:164A-6	nyon mongs ba can gyi yid mtshungs par ldan pa dang bcas pa gang 'gog pa ste /	nyon mongs ba can gyi yid mtshungs ba ldan ba dang 'cha' ba gang mang ba ste 
T06D4064:164A-7	'di yang 'du shes med pa'i snyoms par 'jug pa bzhin du gnas kyi gnas skabs kyi bye brag la gdags so //	mang yang mang shes med ba snyom ba mang ba bzhin du gnas kyi gnas skabs kyi 'bye brag la 'dogs so 
T06D4064:164A-8	sems med pa'i gnyid ni gnas pa nyid stug pos non pa'i phyir dus de srid cig tu yid kyi rnam par shes pa mi 'byung bas sems med pa zhes bya'o //	sems med ba rnyid ni gnas ba nyid stug pos non ba phyir dus de srid cig tu yid kyi rnam ba shes ba mi mang ba sems med ba zhes byed 
T06D4064:164A-9	sems med pa'i brgyal ba ni glo bur du snang ba dang /	sems med ba brgyal ba ni glo bur du snang ba dang 
T06D4064:164A-10	rlung dang mkhris pa dang bad kan ma mnyam pa ste /	rlung dang mkhris ba dang bad kan ma mnyam ba ste 
T06D4064:164A-11	gnas ma mnyam pas yid kyi rnam par shes pa 'byung ba dang mi mthun pa gang yin pa de la sems med pa'i brgyal ba zhes nye bar 'dogs so //	gnas ma mnyam ba yid kyi rnam ba shes ba mang ba dang mi mthun ba gang yin ba de la sems med ba brgyal ba zhes nye ba mang so 
T06D4064:164A-12	gnas skabs lnga po de dag las ma gtogs pa de ma yin pa'i dus thams cad du yid kyi rnam par shes pa 'byung bar rig par bya'o //	gnas skabs lnga po de 'dag las ma gtogs ba de ma yin ba dus thams cad du yid kyi rnam ba shes ba mang ba rig ba byed 
T06D4064:164A-13	de ltar 'du shes med pa la sogs pa rnam par shes pa 'gags te med par gyur pa de phyis ci las 'byung na gang gi phyir de dag 'chi ba'i dus byed par mi 'gyur zhe na /	de ltar mang shes med ba la sogs ba rnam ba shes ba mang te med ba gyur ba de 'byid ci las mang na gang gi phyir de 'dag mang ba dus byed ba mi mang zhe na 
T06D4064:164A-14	de ni kun gzhi rnam par shes pa nyid las 'byung ste /	de ni kun gzhi rnam ba shes ba nyid las mang ste 
T06D4064:164A-15	de yang rnam par shes pa thams cad kyi sa bon can no //	de yang rnam ba shes ba thams cad kyi sa bon can no 
T06D4064:164A-16	rnam par shes pa gyur pa gang la bdag dang chos nye bar 'dogs pa de rnam pa gsum du bstan brgya cher rnam pa gsum du bshad zin to /	rnam ba shes ba gyur ba gang la bdag dang chos nye ba mang ba de rnam ba gsum du ston brgya cher rnam ba gsum du 'chad zin to 
T06D4064:164A-17	"//
 / da ni bdag dang chos su nye bar 'dogs pa 'byung ba gang yin pa de rnam par shes pa gyur ba nyid de /"	da ni bdag dang chos su nye ba mang ba mang ba gang yin ba de rnam ba shes ba gyur ba nyid de 
T06D4064:164A-18	rnam par shes pa gyur ba las gud na bdag dang chos med do zhes gang dam bcas pa de rab tu bsgrub pa'i phyir /	rnam ba shes ba gyur ba las 'gud na bdag dang chos med do zhes gang dam 'cha' ba de rab tu sgrub ba phyir 
T06D4064:164A-19	rnam par shes pa gyur pa 'di //	rnam ba shes ba gyur ba mang 
T06D4064:164A-20	rnam rtog yin te de yis gang //	rnam rtogs yin te de yis gang 
T06D4064:164B-0	rnam pa rtags de med des na @164b 'dis //	rnam ba rtags de med des na mang 
T06D4064:164B-1	thams cad rnam par rig pa tsam //	thams cad rnam ba rig ba tsam 
T06D4064:164B-2	zhes bya ba smos so //	zhes byed ba smos so 
T06D4064:164B-3	rnam par shes pa gyur pa rnam gsum bshad ma thag pa gang yin pa de ni rnam par rtog pa'o //	rnam ba shes ba gyur ba rnam gsum 'chad ma thag ba gang yin ba de ni rnam ba rtogs ba 
T06D4064:164B-4	sgro btags pa'i don gyi rnam pa khams gsum pa'i sems dang sems las byung ba ni rnam par rtog pa zhes bya ste /	sgro 'dogs ba don gyi rnam ba khams gsum ba sems dang sems las 'byung ba ni rnam ba rtogs ba zhes byed ste 
T06D4064:164B-5	ji skad du ;	ji skad du 
T06D4064:164B-6	yang dag ma yin kun rtog ni //	yang 'dag ma yin kun rtogs ni 
T06D4064:164B-7	sems dang sems byung khams gsum pa //	sems dang sems 'byung khams gsum ba 
T06D4064:164B-8	zhes bshad pa lta bu'o //	zhes 'chad ba lta bu 
T06D4064:164B-9	rnam par rtog pa rnam pa gsum po kun gzhi rnam par shes pa dang nyon mongs pa can gyi yid dang /	rnam ba rtogs ba rnam ba gsum po kun gzhi rnam ba shes ba dang nyon mongs ba can gyi yid dang 
T06D4064:164B-10	'jug pa'i rnam par shes pa'i rang bzhin mtshungs par ldan pa dang bcas pa des gang rnam par brtags pa snod dang /	mang ba rnam ba shes ba rang bzhin mtshungs ba ldan ba dang 'cha' ba des gang rnam ba rtog ba snod dang 
T06D4064:164B-11	bdag dang /	bdag dang 
